{
  "schema_name": "petra.outbox-record",
  "schema_version": "1.2.0",
  "outbox_id": "outbox_01K4C000000000000000000022",
  "outbox_position": 7,
  "target": "interface_authority",
  "target_sequence": 4,
  "partition_key": "project_01ARZ3NDEKTSV4RRFFQ69G5FAW",
  "deduplication_key": "interface_authority:event:source-excluded:021",
  "enqueued_at": "2026-09-09T00:00:00.000Z",
  "message": {
    "message_kind": "domain_event",
    "event": {
      "schema_name": "petra.domain-event",
      "schema_version": "1.2.0",
      "event_id": "event_01K4C000000000000000000021",
      "event_position": 4,
      "stream_type": "project",
      "stream_id": "project_01ARZ3NDEKTSV4RRFFQ69G5FAW",
      "stream_revision": 4,
      "project_id": "project_01ARZ3NDEKTSV4RRFFQ69G5FAW",
      "actor": {
        "actor_id": "actor_01ARZ3NDEKTSV4RRFFQ69G5FAV",
        "actor_kind": "human"
      },
      "occurred_at": "2026-09-09T00:00:00.000Z",
      "recorded_at": "2026-09-09T00:00:00.000Z",
      "correlation_id": "trace_01ARZ3NDEKTSV4RRFFQ69G5FBK",
      "causation_id": "command_01K4C000000000000000000020",
      "command_id": "command_01K4C000000000000000000020",
      "idempotency_key": "project-source:007:exclude:v1",
      "capability_grant_id": "capability_grant_01ARZ3NDEKTSV4RRFFQ69G5FBJ",
      "event": {
        "event_type": "project_source.excluded",
        "payload": {
          "prior_source_ref": {
            "project_source_id": "project_source_01K4C000000000000000000007",
            "revision": 1,
            "content_hash": "sha256:c6e1c7abe0e2c29f7dc0454d1c6d6ab10526fd3f82612299053b1aa88d5fc4db",
            "record_hash": "sha256:fa6206f9dd4c3a574d7afb9df2c77a3b4522f18be88d7dca01143534590f7b5c",
            "status": "active"
          },
          "project_source": {
            "schema_name": "petra.project-source",
            "schema_version": "1.0.0",
            "project_source_id": "project_source_01K4C000000000000000000007",
            "revision": 2,
            "project_id": "project_01ARZ3NDEKTSV4RRFFQ69G5FAW",
            "content": {
              "binding_kind": "scientific_work_version",
              "project_definition_ref": {
                "project_definition_id": "project_definition_01K4C000000000000000000001",
                "revision": 1,
                "content_hash": "sha256:0574f491dbf0d3893bbe80b7b47ffc540471430878416aabef51a9a7703627c9"
              },
              "source_role": "scientific.literature",
              "work_ref": {
                "work_id": "work_01ARZ3NDEKTSV4RRFFQ69G5FAZ",
                "revision": 1,
                "record_hash": "sha256:617df314092d3bc433c21ad70790e0d02e8b88e2341f7988eb75df376ef4e923"
              },
              "work_version_ref": {
                "work_version_id": "work_version_01ARZ3NDEKTSV4RRFFQ69G5FB0",
                "revision": 1,
                "record_hash": "sha256:dba5ca5f392635236e74d317bf2b7443e70c9e991fe85d11f18e5ccaf163f965"
              },
              "author_refs": [
                {
                  "author_id": "author_01ARZ3NDEKTSV4RRFFQ69G5FAY",
                  "revision": 1,
                  "record_hash": "sha256:3395daa2ca66fbdf22218eb6284afbfb632a48319ad62ce1cecc4ca667f61363"
                }
              ],
              "artifact_manifest_ref": {
                "artifact_manifest_id": "artifact_manifest_01ARZ3NDEKTSV4RRFFQ69G5FB2",
                "revision": 1,
                "record_hash": "sha256:ca96cf837e75855d9674162b6df72d1986a43dc4c26879bb703acd6b54a59ac8"
              },
              "status": "excluded"
            },
            "content_hash": "sha256:97efe03df69d4d9cff66a78bd5b7929ecaba625d08086cbca3f6e4f26b8f566d",
            "added_by": {
              "actor_id": "actor_01ARZ3NDEKTSV4RRFFQ69G5FAV",
              "actor_kind": "human"
            },
            "added_at": "2026-09-09T00:00:00.000Z"
          }
        }
      }
    }
  }
}
